{
  "AgentId": "DOCUMENTATION_REVIEWER",
  "AgentVersion": "external-bootstrap-1.0.0",
  "GateId": "FIRST_WAVE_PROVISIONAL_BUILD",
  "Branch": "feature/agent-platform-v2-integration",
  "CommitSHA": "7c81e2e28f04e4bbf9e5e56744afbe600d99cfc1",
  "ReviewScope": "Phase 3B/3C traceability, owner scope, selection state and ADR status",
  "FilesReviewed": ["rfc/RFC-AGENT-PLATFORM-V2.md", "adr/ADR-AGENT-PLATFORM-V2.md", "audit/agents/OWNER-DECISION-FIRST-WAVE-2026-07-22.md", "audit/agents/upstream-selection-report.md", "AGENTS.md"],
  "SpecificationReferences": ["IOS Master Specification v4.0", "IOS Agent Platform Specification v2.1", "OWNER_DECISION_FIRST_WAVE_20260722"],
  "ChecksPerformed": ["Phase 3B/3C consistency", "historical selection supersession", "current 18/26/0 state", "five-agent owner scope", "staging-only generation", "model policy", "ADR DRAFT_NOT_ACCEPTED"],
  "Findings": [
    {"Severity": "LOW", "Description": "External activation evidence and accepted ADR remain deliberately absent."}
  ],
  "Severity": "LOW",
  "Evidence": ["AgentThreadId=/root/phase3a_documentation_review", "ExecutionMode=EXTERNAL_BOOTSTRAP_REAL_SUBAGENT", "modelRequested/modelResolved=UNVERIFIED", "No HIGH/CRITICAL/BLOCKER at exact reviewed SHA", "TrustedAttestation=INSUFFICIENT_EVIDENCE"],
  "RequiredFixes": [],
  "ResidualRisk": "Repository documentation cannot prove runtime enforcement, external attestation or live production state.",
  "Status": "PASS_WITH_WARNINGS",
  "Timestamp": "2026-07-25T23:46:14Z",
  "ExecutionMode": "REAL_SUBAGENT"
}
