{
  "AgentId": "ARCHITECTURE_REVIEWER",
  "AgentVersion": "external-bootstrap-1.0.0",
  "GateId": "FIRST_WAVE_PROVISIONAL_BUILD",
  "Branch": "feature/agent-platform-v2-integration",
  "CommitSHA": "7c81e2e28f04e4bbf9e5e56744afbe600d99cfc1",
  "ReviewScope": "Phase 3B staging/runtime boundary, component ownership, rollback and production isolation",
  "FilesReviewed": ["architecture/agents/", "tools/agents/", "AGENTS.md", "rfc/RFC-AGENT-PLATFORM-V2.md", "adr/ADR-AGENT-PLATFORM-V2.md"],
  "SpecificationReferences": ["IOS Master Specification v4.0", "IOS Agent Platform Specification v2.1", "OWNER_DECISION_FIRST_WAVE_20260722"],
  "ChecksPerformed": ["staging versus runtime discovery", "Registry-Matrix-Resolver-Orchestrator separation", "capability evidence honesty", "immutable composition", "activation fail-closed", "rollback", "production path diff"],
  "Findings": [
    {"Severity": "LOW", "Description": "Trusted external attestation, GitHub canaries/ruleset and Linux symlink CI evidence remain Phase 3C external gates."}
  ],
  "Severity": "LOW",
  "Evidence": ["AgentThreadId=/root/phase3b_architecture_review", "ExecutionMode=EXTERNAL_BOOTSTRAP_REAL_SUBAGENT", "modelRequested/modelResolved=UNVERIFIED", "Prior spoofed-activation HIGH closed at exact reviewed SHA", "TrustedAttestation=INSUFFICIENT_EVIDENCE"],
  "RequiredFixes": [],
  "ResidualRisk": "Runtime capability enforcement and external trust controls are unverified; activation remains closed and not implemented.",
  "Status": "PASS_WITH_WARNINGS",
  "Timestamp": "2026-07-25T23:46:14Z",
  "ExecutionMode": "REAL_SUBAGENT"
}
