{
  "AgentId": "PERFORMANCE_AUDITOR",
  "AgentVersion": "1.0.0",
  "GateId": "GLOBAL-AGENT-GOVERNANCE",
  "Branch": "codex-global-agent-governance",
  "CommitSHA": "93909f69dc58da0cdc25eed170666024820ecfc4",
  "ReviewScope": "Deterministic resolver/validator performance and proof of zero runtime performance impact",
  "FilesReviewed": ["tools/agent-governance-lib.mjs", "tools/resolve-required-agents.mjs", "tools/validate-agent-governance.mjs", "tests/agent-governance/", ".github/workflows/agent-governance.yml"],
  "SpecificationReferences": ["Master Specification 20", "Master Specification 22:38-50"],
  "ChecksPerformed": ["single local git diff resolution", "no network or production API in resolver", "bounded registry/matrix traversal", "test-suite runtime", "workflow timeout"],
  "Findings": [],
  "Severity": "INFO",
  "Evidence": ["31 tests completed in approximately 1.2 seconds on local Windows run", "workflow timeout-minutes: 10", "no production benchmark executed", "runtime Apps Script source unchanged"],
  "RequiredFixes": [],
  "ResidualRisk": "Repository growth may increase linear path-rule matching cost; current scale is small and CI timeout is bounded.",
  "Status": "PASS",
  "Timestamp": "2026-07-18T08:08:45Z",
  "ExecutionMode": "CODEX_ROLE_SIMULATION"
}
