{
  "AgentId": "GOOGLE_SHEETS_REVIEWER",
  "AgentVersion": "1.0.0",
  "GateId": "GLOBAL-AGENT-GOVERNANCE",
  "Branch": "codex-global-agent-governance",
  "CommitSHA": "8db70b095d7480530402c5578d395a156b377110",
  "ReviewScope": "False-positive-safe review of schema-named governance files and proof of zero Sheets impact",
  "FilesReviewed": ["architecture/agents/agent-registry.schema.json", "architecture/agents/review-matrix.schema.json", "architecture/agents/review-contract.schema.json", "architecture/agents/review-manifest.schema.json", ".codex/agents/google-sheets-reviewer.toml"],
  "SpecificationReferences": ["Master Specification 08", "Master Specification 21", "Master Specification 28"],
  "ChecksPerformed": ["distinguish JSON governance schemas from Sheets schemas", "no schema-parts diff", "no formulas or workbook artifacts", "no Sheets API/MCP write", "migration not required"],
  "Findings": [],
  "Severity": "INFO",
  "Evidence": ["git diff for IOS_SOURCE_SNAPSHOT/work/schema-parts/**: empty", "no .xlsx/.csv/.tsv changes", "Google Sheets writes: 0", "required review retained because resolver intentionally fails safe on schema paths"],
  "RequiredFixes": [],
  "ResidualRisk": "The generic data-model rule may over-select this reviewer for non-Sheets JSON schemas; over-selection is safe and documented.",
  "Status": "NOT_APPLICABLE",
  "Timestamp": "2026-07-18T08:08:45Z",
  "ExecutionMode": "CODEX_ROLE_SIMULATION"
}
