{
  "AgentId": "ARCHITECTURE_REVIEWER",
  "AgentVersion": "1.0.0",
  "GateId": "GLOBAL-AGENT-GOVERNANCE",
  "Branch": "codex-global-agent-governance",
  "CommitSHA": "055fb47bf83a9376842eea6b57d1f6bf67d2cc9b",
  "ReviewScope": "Agent Governance Layer, instruction inheritance, registry/matrix/resolver boundaries and CI enforcement",
  "FilesReviewed": ["AGENTS.md", "architecture/agents/", "tools/agent-governance-lib.mjs", "tools/resolve-required-agents.mjs", ".github/workflows/agent-governance.yml", "rfc/RFC-GLOBAL-AGENT-GOVERNANCE.md", "adr/ADR-GLOBAL-AGENT-GOVERNANCE.md"],
  "SpecificationReferences": ["Master Specification 03", "Master Specification 21", "Master Specification 22", "Master Specification 23", "Correction Memo v1"],
  "ChecksPerformed": ["source-of-truth and layer separation", "repository versus CI enforcement boundary", "instruction inheritance", "anti-tamper paths", "RFC/ADR traceability", "rollback and branch inheritance"],
  "Findings": [],
  "Severity": "INFO",
  "Evidence": ["node tools/validate-agent-governance.mjs --all: PASS", "node --test tests/agent-governance: 31/31 PASS", "canonical worktree status clean at review", "runtime IOS and investment modules absent from diff"],
  "RequiredFixes": [],
  "ResidualRisk": "AGENTS.md guides clients but cannot itself enforce execution; hard enforcement depends on the workflow becoming a required ruleset check after merge.",
  "Status": "PASS",
  "Timestamp": "2026-07-18T08:08:45Z",
  "ExecutionMode": "CODEX_ROLE_SIMULATION"
}
